{"$schema":"https://artemsemdev.github.io/SeaRise-Europe/contracts/release/v1/architecture-evidence.schema.json","codeRevision":"c096aeab4e0994faa7a9d2253b47215ef897dfcb","dataProvenanceClass":"synthetic-fixture","dataReleaseId":"searise-europe-v1.0.0-20260810-c096aeab4e09","generatedAt":"2026-08-10T12:03:00Z","measurements":[{"evidencePath":"evidence/architecture.json","name":"cached-projection-lookup-p95","observed":null,"status":"pending","threshold":100,"unit":"ms"}],"privacy":{"coordinatesSentToProjectServer":false,"searchSentToProjectServer":false},"runtime":{"applicationApiCalls":0,"prohibitedRoutes":["/assess","/geocode","/config"],"scientificLookupArtifact":"projection-analysis-cog"},"schemaVersion":"1.0.0"}
